{
  "business": "Example Sign Studio / fictional",
  "selectedService": "shop",
  "routes": [
    {
      "id": "shop",
      "label": "Shop sign",
      "questions": [
        {
          "id": "location",
          "label": "Where will the sign be installed?",
          "required": true
        },
        {
          "id": "message",
          "label": "What should the sign say?",
          "required": true
        }
      ]
    },
    {
      "id": "vehicle",
      "label": "Vehicle lettering",
      "questions": [
        {
          "id": "vehicles",
          "label": "How many vehicles need lettering?",
          "required": true
        },
        {
          "id": "artwork",
          "label": "Do you already have artwork?",
          "required": false
        }
      ]
    },
    {
      "id": "update",
      "label": "Update existing artwork",
      "questions": [
        {
          "id": "changes",
          "label": "What needs to change?",
          "required": true
        }
      ]
    }
  ],
  "answers": {
    "location": "Above the shop entrance",
    "message": "A clear name and opening information",
    "vehicles": "Inactive answer that must not appear"
  }
}
